disease,definition,care,warning,medications,causes,prevention
Vitamin D Deficiency,"Condition where the body has low vitamin D, affecting bone health.","Safe sun exposure, vitamin D rich foods, supplements.",Consult a doctor if persistent bone pain or muscle weakness occurs.,Vitamin D supplements.,"Low sunlight exposure, poor diet.","Sunlight, vitamin D-rich diet."
Vitamin B12 Deficiency,"Low vitamin B12 causing weakness, anemia, or nerve problems.","Vitamin B12 supplements, healthy diet.","Seek care if severe fatigue, tingling, or memory issues occur.",Vitamin B12 injections or tablets.,"Poor diet, absorption issues.",Balanced diet with animal products or fortified foods.
Dehydration,"Loss of fluids leading to weakness, dry mouth, and dizziness.","Drink water, oral rehydration solutions, rest.","Seek urgent help if confusion, fainting, or severe dehydration signs occur.","ORS, IV fluids (if prescribed).","Excessive sweating, diarrhea, vomiting.","Stay hydrated, especially in hot weather."
Malnutrition,Lack of proper nutrients leading to weakness and health issues.,"Balanced diet, supplements, regular meals.","Seek medical advice if weight loss, weakness, or delayed growth occur.",Nutritional supplements (as prescribed).,"Poor diet, poverty, chronic illness.","Balanced nutrition, health education."
Heat Stroke,Severe condition from overheating with high fever and confusion.,"Cool the body immediately, drink fluids, rest in shade.","Seek emergency care if unconsciousness, seizures, or very high temperature occur.","IV fluids, cooling therapy (hospital).","Prolonged heat exposure, dehydration.","Stay hydrated, avoid excessive heat."
Hypothermia,Dangerous drop in body temperature due to cold exposure.,"Warm gradually with blankets, warm drinks.","Seek emergency help if shivering stops, confusion, or unconsciousness occurs.",Hospital rewarming techniques.,"Cold weather exposure, wet clothing.","Wear warm layers, avoid long exposure to cold."
Lung Cancer,"Cancer starting in the lungs, often linked to smoking.","Healthy lifestyle, medical treatments as prescribed.","Seek care if persistent cough, blood in sputum, or chest pain occurs.","Chemotherapy, radiation, surgery (as prescribed).","Smoking, pollution, genetics.","Avoid smoking, regular checkups."
Colorectal Cancer,Cancer affecting the colon or rectum.,"Healthy diet, medical treatments as advised.","Seek care if blood in stool, weight loss, or persistent abdominal pain occurs.","Surgery, chemotherapy, radiation.","Genetics, diet, lifestyle.","Routine screening, high fiber diet."
Stomach Cancer,Cancer developing in the stomach lining.,"Medical treatment, healthy diet, supportive care.","Seek care if persistent indigestion, pain, or vomiting blood occurs.","Surgery, chemotherapy, radiation.","H. pylori infection, smoking, diet.","Healthy diet, avoid smoking, screening."
Liver Cancer,Cancer starting in the liver.,"Medical treatment, supportive care, lifestyle adjustments.","Seek urgent care if jaundice, weight loss, or severe abdominal swelling occurs.","Surgery, chemotherapy, targeted therapy.","Hepatitis infections, alcohol, cirrhosis.","Vaccination (Hepatitis B), limit alcohol."
Pancreatic Cancer,Aggressive cancer starting in the pancreas.,"Supportive care, medical treatments, nutrition support.","Seek care if jaundice, severe weight loss, or pain occurs.","Surgery, chemotherapy (as prescribed).","Genetics, smoking, obesity.","Healthy diet, avoid smoking."
Skin Cancer (Melanoma),Cancer starting in pigment cells of the skin.,"Medical treatment, skin protection, regular checks.","Seek urgent help if mole changes shape, color, or bleeds.","Surgery, targeted therapy.","UV exposure, genetics.","Use sunscreen, avoid tanning."
Blood Cancer (Leukemia),Cancer of blood-forming tissues affecting bone marrow.,"Medical treatment, healthy diet, supportive care.","Seek care if frequent infections, bruising, or fatigue occurs.","Chemotherapy, bone marrow transplant.","Genetics, radiation, unknown factors.","Regular checkups, avoid harmful exposures."
Conjunctivitis (Pink Eye),Inflammation of the eye lining causing redness and discharge.,"Clean eyes, avoid touching, use prescribed drops.","Seek care if vision problems, pain, or symptoms worsen.",Antibiotic/antiviral drops (as prescribed).,"Bacterial or viral infections, allergies.","Hand hygiene, avoid sharing personal items."
Cataract,Clouding of the eye lens causing blurry vision.,"Protect eyes, use prescribed glasses, surgery if needed.",Seek care if vision loss affects daily life.,Surgery (lens replacement).,"Aging, genetics, diabetes.","Regular eye checkups, UV protection."
Glaucoma,"Eye condition causing damage to the optic nerve, often with high eye pressure.","Use prescribed eye drops regularly, protect eyes.",Seek urgent care if sudden vision loss or eye pain occurs.,"Eye drops, surgery (as prescribed).","High eye pressure, genetics.","Regular screening, early treatment."
Otitis Media (Ear Infection),Infection of the middle ear common in children.,"Pain relief, warm compress, prescribed antibiotics if bacterial.","Seek care if high fever, pus discharge, or hearing loss occurs.","Antibiotics (if bacterial), pain relievers.","Bacterial/viral infections, allergies.","Good hygiene, avoid smoke exposure."
Hearing Loss,Partial or total inability to hear.,"Use hearing aids, protect ears from loud noise.",Seek care if sudden hearing loss or associated dizziness occurs.,"Hearing aids, cochlear implants (if prescribed).","Aging, noise, infections, genetics.","Protect ears from loud noise, regular checkups."
Vertigo,Sensation of spinning or imbalance often due to inner ear issues.,"Rest, slow movements, hydration.","Seek care if severe, recurrent, or associated with hearing loss.","Meclizine, vestibular suppressants (as prescribed).","Inner ear problems, infections.","Avoid sudden movements, hydration."
Allergic Reactions,Overreaction of the immune system to harmless substances.,"Avoid triggers, use antihistamines.","Seek emergency care if swelling, breathing difficulty, or anaphylaxis occurs.","Antihistamines, Epinephrine (for severe cases).","Food, pollen, insect stings, drugs.","Avoid known allergens, carry emergency medication."
Sepsis,Life-threatening body response to infection.,"Immediate hospital care, IV fluids, antibiotics.","Seek emergency care if confusion, fever, or very low blood pressure occurs.","IV antibiotics, supportive care.",Severe infection spreading in the body.,Prompt treatment of infections.
Lupus (SLE),"Chronic autoimmune disease affecting skin, joints, and organs.","Balanced lifestyle, regular medication, sun protection.",Seek care if severe flare-ups or organ issues occur.,"Immunosuppressants, NSAIDs, corticosteroids.",Genetic and immune factors.,"Regular checkups, sun safety."
Lyme Disease,Infection caused by tick bites leading to rash and fever.,"Rest, fluids, antibiotics as prescribed.",Seek medical care if neurological symptoms or arthritis develop.,Antibiotics (Doxycycline).,Bite from infected ticks.,"Avoid tick areas, use repellents."
Chikungunya,Viral infection spread by mosquitoes causing fever and joint pain.,"Rest, hydration, and pain relief.",Seek medical care if severe dehydration or persistent pain occurs.,"Paracetamol, NSAIDs (avoid aspirin).",Mosquito bites carrying virus.,"Mosquito control, repellents."
Smallpox,Eradicated viral disease once causing fever and skin pustules.,Supportive care only (historical).,No longer occurs naturally since eradication in 1980.,None available (eradicated).,Variola virus.,Global vaccination eradicated it.
Yellow Fever,Viral infection spread by mosquitoes causing fever and jaundice.,"Rest, hydration, supportive hospital care if severe.","Seek emergency care if bleeding, jaundice, or organ failure occurs.","No specific treatment, supportive care.",Mosquito-borne flavivirus.,"Yellow fever vaccination, mosquito control."
